{
  "id": "fariz",
  "display_name_key": "char.fariz",
  "role": "taifa_captain",
  "combat": 64,
  "birth": 60,
  "diplomacy": 40,
  "mesura_max": 30,
  "loyalty_0": 0.0,
  "gift_bias": "arms",
  "essential": false,
  "desertion_capable": false,
  "unkillable": false,
  "list_eligible": false,
  "list_index": -1,
  "recruitable_beat": "a1_alcocer",
  "vo_id": "fariz"
}
