{
  "id": "burgos_child",
  "display_name_key": "char.burgos_child",
  "poem_formula_key": "poem.v20",
  "role": "burgales",
  "combat": 0,
  "birth": 0,
  "diplomacy": 10,
  "mesura_max": 0,
  "loyalty_0": 0.3,
  "gift_bias": "gold",
  "essential": false,
  "desertion_capable": false,
  "unkillable": true,
  "list_eligible": false,
  "list_index": -1,
  "recruitable_beat": "a1_burgos",
  "vo_id": "burgos_child"
}
