{
  "id": "raquel",
  "display_name_key": "char.raquel",
  "role": "usurer",
  "combat": 0,
  "birth": 20,
  "diplomacy": 70,
  "mesura_max": 30,
  "loyalty_0": 0.4,
  "gift_bias": "gold",
  "essential": false,
  "desertion_capable": false,
  "unkillable": true,
  "list_eligible": false,
  "list_index": -1,
  "recruitable_beat": "a1_arcas",
  "vo_id": "raquel"
}
