{
  "id": "sisebuto",
  "display_name_key": "char.sisebuto",
  "role": "bishop",
  "combat": 0,
  "birth": 40,
  "diplomacy": 50,
  "mesura_max": 40,
  "loyalty_0": 0.7,
  "gift_bias": "chapel",
  "essential": false,
  "desertion_capable": false,
  "unkillable": true,
  "list_eligible": false,
  "list_index": -1,
  "recruitable_beat": "a1_cardena",
  "vo_id": "sisebuto"
}
