{
  "id": "alvar_fanez",
  "display_name_key": "char.alvar_fanez",
  "role": "captain",
  "combat": 72,
  "birth": 50,
  "diplomacy": 90,
  "mesura_max": 70,
  "loyalty_0": 0.72,
  "gift_bias": "land_right",
  "essential": true,
  "desertion_capable": false,
  "unkillable": false,
  "list_eligible": false,
  "list_index": -1,
  "recruitable_beat": "a1_vivar",
  "vo_id": "alvar_fanez"
}
