{
  "id": "diego_tellez",
  "display_name_key": "char.diego_tellez",
  "role": "ally",
  "combat": 40,
  "birth": 30,
  "diplomacy": 40,
  "mesura_max": 40,
  "loyalty_0": 0.5,
  "gift_bias": "horses",
  "essential": false,
  "desertion_capable": false,
  "unkillable": false,
  "list_eligible": false,
  "list_index": -1,
  "recruitable_beat": "a3_corpes",
  "vo_id": "diego_tellez"
}
