{
  "id": "yusuf",
  "display_name_key": "char.yusuf",
  "role": "taifa_king",
  "combat": 70,
  "birth": 95,
  "diplomacy": 50,
  "mesura_max": 40,
  "loyalty_0": 0.0,
  "gift_bias": "horses",
  "essential": false,
  "desertion_capable": false,
  "unkillable": false,
  "list_eligible": false,
  "list_index": -1,
  "recruitable_beat": "a2_yusuf",
  "vo_id": "yusuf"
}
