{
  "id": "garcia_ordonez",
  "display_name_key": "char.garcia_ordonez",
  "role": "count",
  "combat": 40,
  "birth": 95,
  "diplomacy": 60,
  "mesura_max": 10,
  "loyalty_0": 0.05,
  "gift_bias": "gold",
  "essential": false,
  "desertion_capable": false,
  "unkillable": false,
  "list_eligible": false,
  "list_index": -1,
  "recruitable_beat": "a2_tagus",
  "vo_id": "garcia_ordonez"
}
