{
  "id": "jimena",
  "display_name_key": "char.jimena",
  "role": "family",
  "combat": 5,
  "birth": 50,
  "diplomacy": 70,
  "mesura_max": 80,
  "loyalty_0": 1.0,
  "gift_bias": "chapel",
  "essential": true,
  "desertion_capable": false,
  "unkillable": true,
  "list_eligible": false,
  "list_index": -1,
  "recruitable_beat": "a1_cardena",
  "vo_id": "jimena"
}
